{
  "schema_version": "1.0.0",
  "task_id": "task_synthetic_example",
  "candidate_id": "repro_12345678-1234-5678-9234-567812345678",
  "release_id": "repro_tasks_2026_08_pilot_v1",
  "split": "evaluation_only",
  "paper": {
    "doi": "10.1234/example.2026",
    "title": "Synthetic paper used only to validate the canonical schema",
    "artifact_id": "artifact_paper_pdf",
    "path": "paper.pdf",
    "sha256": "1111111111111111111111111111111111111111111111111111111111111111"
  },
  "package": {
    "artifact_id": "artifact_author_package",
    "family_key": "RR_EXAMPLE_2026_001",
    "release_key": "RR_EXAMPLE_2026_001:v1",
    "root_path": "replication_package/",
    "file_manifest_path": "replication_package.manifest.json",
    "file_manifest_sha256": "2222222222222222222222222222222222222222222222222222222222222222",
    "file_count": 12,
    "total_bytes": 200000
  },
  "targets": [
    {
      "finding_id": "table_1",
      "type": "table",
      "paper_label": "Table 1",
      "verbatim_claim": null,
      "paper_locator": {
        "page": 4,
        "section": "Results",
        "label": "Table 1"
      }
    }
  ],
  "environment": {
    "container_or_vm_digest": "sha256:aaaaaaaaaaaaaaaaaaaaaaaaaaaaaaaaaaaaaaaaaaaaaaaaaaaaaaaaaaaaaaaa",
    "languages": [
      "r"
    ],
    "software": [
      {
        "name": "R",
        "version": "4.5.1",
        "proprietary": false
      }
    ],
    "network_policy": "disabled",
    "allowed_hosts": []
  },
  "resource_limits": {
    "wall_clock_seconds": 7200,
    "cpu_cores": 4,
    "memory_bytes": 17179869184,
    "disk_bytes": 53687091200,
    "max_processes": 256
  },
  "output_contract": {
    "file_name": "reproducibility_score.json",
    "root_relative": true,
    "json_key": "reproducibility_score",
    "value_type": "integer",
    "minimum": 1,
    "maximum": 4
  },
  "licenses": [
    {
      "artifact_id": "artifact_paper_pdf",
      "expression": "CC-BY-4.0",
      "attribution_path": "LICENSES/paper.txt",
      "release_decision": "redistribute_with_attribution"
    },
    {
      "artifact_id": "artifact_author_package",
      "expression": "MIT",
      "attribution_path": "LICENSES/package.txt",
      "release_decision": "redistribute"
    }
  ],
  "source_provenance": [
    {
      "source_key": "world_bank",
      "source_record_id": "RR_EXAMPLE_2026_001",
      "source_url": "https://reproducibility.worldbank.org/catalog/999999",
      "retrieved_at": "2026-08-21T12:00:00Z"
    }
  ],
  "integrity": {
    "public_tree_manifest_sha256": "3333333333333333333333333333333333333333333333333333333333333333",
    "all_files_materialized": true,
    "hashes_verified": true,
    "path_contract_verified": true,
    "leakage_audit_status": "pass",
    "family_split_status": "pass",
    "clean_execution_count": 2
  },
  "built_at": "2026-08-21T15:00:00Z"
}
